{
  "eventId": "019bd6b0-7777-7acb-85dc-415263748804",
  "occurredAt": "2026-09-12T10:15:00.0000000+00:00",
  "aggregateId": "019bd6b0-aaaa-7c3a-9d5e-2f4a6b8c0d1e",
  "organisationId": "019bcf7f-9d10-7b21-84c6-5e7f8a9b0c1d",
  "branchId": "019bcf7f-a204-7f38-9c52-6d7e8f90a1b2",
  "paymentId": "019bd6b0-8888-7c3a-9d5e-2f4a6b8c0d1e",
  "invoiceId": "019bd6b0-3333-7e4b-8f6a-3a5b7c9d1e2f",
  "amount": 500.0,
  "remaining": 0.0,
  "currency": "INR",
  "eventType": "billing.advance-applied.v1",
  "schemaVersion": 1
}
